"Reviewer_name","Review_text","Rating"
"batravn","Enomania has long had a reputation as being one of the absolute topclass Italian restaurants in Copenhagen. Hidden away on a humble adress close to the Copenhagen Zoo, you get excellent service, even better food (including the best risotto ever) and a wine cellar probably unmatched in any Italian restaurant, especially since the owner is not ""religious"" about serving only Italian wine. All of this for a price that is more than fair.","50"
"What_we_did_together","Great restaurant, authentic Italian with superb food and great wine - especially barolos ! If weather is great you can sit outside in a cosy courtyard...","50"
"byMT305","Everything that you've read about Enomania on-line is true -- the food is outstanding and the hospitality is wonderful !! The menu changes daily, and I would highly recommend taking-the-plunge for the full 4-course tasting menu. I have to admit that I'm usually a little skittish about set menus w/ no choices and that I ""flinched"" at the unusual-sounding ingredients (cod, pea, boar, etc) ... again, my advice: Don't ""skip"" anything. Go for it. We enjoyed the following: Homemade pasta course (agnolotti w/ cod & pea) - scrumptious! House specialty risotto (truffle) - outstanding! buttery!! Sliced filet - delicious beef w/ roasted vegetables with pesto seasoning **Pan-roasted turbo - for the non-meat eater ... the attentive chef/owner said ""No problem at all, & prepared a mouth-watering fish entree w/ roasted vegetables) Dessert - homemade strawberry gelato w/ whipped cream and cake - Delicious!! In summary, do everything you can to book a reservation for Enomania!!","50"
"Riplis","We visited Egomania during our trip to Copenhagen. We ordered a four course meal with complementary wine pairing.  The four courses was ravioli with cod white asparges and pies, risotto, beef with grilled vegetables and pesto, and strawberry ice-cream served with white chocolate cake.  All four courses were excellent. The dessert was outstanding and worth the visit itself.  The prices are decent for such great food. Enomania clearly deserves their Bib Gourmand status.","50"
"nikolaj K","For sure one of the best italian restaurants in Copenhagen. The food is very authentic italian and so is the restaurant itself.","40"
"Rasmus R","Absolutely delightful little italian place. Clean cut danish decor yet super cosy due to its intimate size. A limited menu with a handfull of quality dishes made with love. On top of a 20 page winelist, the heart for wine shows in this place. For someone (like me) who can barely taste the difference between red and white then the passionate gentleman still explained all about the wine menu with true dedication. Service was top nudge! This feeling you had when you were five yeats old and equipped with crayons and paper at a restaurant - came crawling up on me as they just succeed making me feel special and well looked after...","50"
"JanochBarbro","This is our third visit, now with a group of friends. This is not a five star luxury style of restaurant, or fancy ""fine dining"" but a small and crowded truly Italian place, with home made pasta, risotto, secondo and dessert. Menu changes so you don't know in advance what will be on offer. But it's like family home cooking, with a twist. And the quality of cooking and service is very, very good indeed. On top of the food experience, the wine list is absolutely fantastic. Great choices from Burgundy and Piemonte, and at great prices.","50"
"PerK514","A great small spot in Copenhagen. I have been here several times, in a business setting, with friends and with fellow wine-geeks, and every single time this place has been spot on  Go there, enjoy the exceptional food, the service (not only are they friendly but they know what the talk about) and last but not least the selection of wine","40"
"Elaine O","I visited this restaurant at the end of the lunchtime sitting with a friend I was visiting from England. We were given a great welcome and the staff went out of their way to provide a beautiful meal even though the kitchen was closing. The recommended wine was excellent and accompanied the meal fantastically, Highly recommended.","50"
"jr021966","One of the best Italian restaurants in Copenhagen. Risotto to die for, and an amazing wine list. Extremely nice atmosphere. Bib gourmand from Michelin several years in a row. Reserve a table well in advance - especially for Friday's. Not open on Saturday.","50"
"JanochBarbro","This is a small restaurant with rather simple decour - but don't let that fool you!! This is a top quality restaurant, visited by business people and famous chefs alike. Food is genuine, truly Italian of top quality. Slow food, rustic made with the heart and a genuine knowledge of Italy and Italian delights. Incredible wine list, formiddable!! This time we had lunch and tasted all Three available options. All were fantastic!!! The wine pairing was also excellent. Service reasonably fast and very friendly&helpful. If you can get a table - go there!! You normally need to reserve a very looooooong time in advance.","40"
"Jo65_DK","This place is ruined by Damiano Aliberti (an Italian) and his wife. Therefore you can immediately feel like you were in Italy. Great atmosphere and warm service. You feel like at home. Damiano's passion for quality wines is reflected in the bottles and wine menu. The food is authentic, full of flavour and tasty. Best Italian trattoria in town. Don't miss it.","50"
"Lawmoalem","Damiano's personal style and touch is unrivalled. The food is rich, tasteful and basic without being simple, and the wines cherry picked and very reasonably priced. It is simply the best Italian restaurant in town. I have been there half a dozen times, and I have never had a bad experience.","50"
"global_foodie_fan","I don't have a stake in this place but I wish I did but if I did I wouldn't ever go anywhere else in Copenhagen! It's now a must whenever I stop over and you shouldn't miss it. It's the very rare combination of sharply executed Italian food in a great atmosphere for not a lot of money. Incredibly, add to this a wine list out of this world at very reasonable mark ups, you really feel like a king (with your wallet intact) walking out of this place. The risotto with peas and sea scallop is Milanese style, al dente and can't be had better in Italy! even by Gualtiero Marchesi, the king of risotto (try him at L'Albereta in Erbusco). Don't miss but be warned, you can't just show up, book ahead to avoid disappointment.","50"
"RNdinner","This italian place is still going strong! Difficult to describe the menu as it changes weekly. But normally it consists of a selection of italian hams/ risotto / pasta / meat / dessert at a price of Dkk 375!!! The food is amazing, the service is extremely friendly, the prices are low and topped with an incredible wine list. The restaurant it self is a bit low-key but always packed so remember to book ahead to avoid disappointment. Would I come back? Yes, again and again!!","50"
"Shhh26","If you get the chance and from what I understand you may have to reserve a table, do try to have a meal at Enomania. The food is very very special and the wine is superb. I loved it, it was so easy, a small choice of dishes and wonderful wine to enhance each course. The atmosphere is relaxed and friendly - so easy, but for a restaurant of this quality so unusual. It was a real treat and a great way to start my first trip to Copenhagen - go there if you can.","40"
"Bobbrs","It is a wine bar, but they also have a menu with 4 courses. Where one is a dessert. When you compare price to food quality, the quality is superb. Best value for money. If you like Italien food, visit this place. Service is, as service should be.","40"
"manyams","This is our regular for special occasions! We absolutely love this place. It is a wine bar, and have a set menu of 4 options (including one dessert). Each dish has a wine paired with it, and these combinations are absolutely amazing. We find the food here amazing, the wine is great as well and the staff is nice and friendly. The food is innovative, and delicious! We've been there twice, and both times we have had a great experience. The place is very small and intimate. It is definitely not a cheap place, however, it is a great restaurant in Copenhagen and the prices are definitely comparable. Super recommended for a special occasion!","50"
"Einar S","Situated right next to the Søndermarken park area, the restaurant Enomania offered a set menu (three or four courses) with an excellent wine pairing.   The kitchen offered a small selection of antipasti on the house while finishing your prosecco. First course was a ricotta ravioli with pan sired scallops and peas, which was excellent. After this wonderful start, we really had great expectations for the rest of the meal. Although the rest of the courses tasted really good, the kitchen seemed to have come to a complete standstill, and we had to wait for very long to have our next courses served.  The girl waiting our table was friendly and nice.  We’ll recommend this restaurant to all Italy lovers visiting Copenhagen.","40"
"WallingfordEl","While visiting family in Copenhagen, I was treated to lunch and fantastic wines! Having access to many, many Italian restaurants in Philadelphia, it was a wonderful surprise to experience whole different flavors, all authentically delicious! Great spot!","50"
"Lars S","We have eaten at Enomania several times. It's always a pleasure. Damiano, the owner, is the perfect host and his skills on wine is superb. It's one of those small brilliant restaurants that you shouldn't tell about and keep to yourself. Remember to book well in advance. We are not the only couple that knows about this unique place.","50"
"JessJensen","Food was excellent. Service was great. Wine perfected match for the food. Obviously not Michelin standard but a well deserved Bib Gourmand. We would diffinately go again. Enjoy","40"
"RNdinner","I have been lucky enough to visit this place many times ( as I live in the area )and I have never been disappointed. Damiano ( the owner ) is fantastic and he is all about quality food and wine. If you love risotto then this is the place to go. Only problem is that due to their great reviews and success ( plus they also have received a Bib Gourmand from Michelin ) its becoming increasingly difficult to get a table, so you will have to book a couple of weeks in advance, but its worth the trouble. ENJOY","50"
"JeppeSJ","I went here with my family, and had their menu of the day, with wine pairing. It was all really good!!! Great food, great wine, and plenty of it! I loved it. Will for sure go back there.","50"
"CopenhagenChow","Wonderful place serving big, generously poured Italian wines paired with mouthwatering, hearty cuisine. Nice ambience and attentive service, expect around 800 kr per person for the full set menu with wine pairing.","40"
"Karen N","Must be the best Italian food and superb wine in Copenhagen. Not overdone, but just perfect in a truly relaxed setting. The menu was delicious and authentic. Four courses served in harmony with the seasons fresh vegetables. Call in advance if you do not eat meat.   Excellent service and great wine knowledge","50"
"Pkoch","This little restaurant on the outskirts of Copenhagen is a wonderful place. Be sure to book a table because they are open only on Tuesday, Wednesday and Thursday but it is difinitely worth while a visit. We had they menu, with the wine menu and we had 4 dishes with some lovely wines to go with it. We startes out with some antipasta, salami and ham, with some lovely warm bread with olive oil on the plate to dip it in. A whitewine from Gaja to accompany it. Then we had the most lovely risotto, with pumpkin and balsmico - need I say more - the angels sang... Then the main course was some lovely Red deer cooked to perfection. Served with some lovely red wine, that I can't remember the name of now,but it was GOOD. Dessert was Baked Ricotta creme and with that a glass of Icewein. We really nejoyed this meal and we are going back and this time sooner than later !!","50"
"LikeBerlin","My wife and I really enjoyed eating at this restaurant.  Start: Champagne Freshly baked bread, good olive oil, sausage and Parma ham  Risotto with artichokes and halibut saltimbocca -- Fully joy! Wine: Soave Classico   Chestnut pasta with salsiccia (sausage) and great porcino fungo (boletus edulis). Wine: a great Barolo 2005  The pasta dish is best pasta I had in almost 20 years! (Back in 1993 I also got a fantastic pasta by the third chef at Villa Quaranta Park Hotel (Verona, Italy))  Main course: Rack of deer, pumpkin, potatoes and a balsamic sauce Wine: A superb Brunello di Montalcino, Altero« 2004, Poggio Antico  Dessert: Caramelized plums with hazelnuts and ice milk Wine: Recioto della Valpolicella Classico Giovanni Allegrini  Finally: Double espresso and grappa di Amarone.  I will certainly go back and I give Enomania my best recommendations.","50"
"bartholdy","The set 4 couurse menu and preselected wine menu come at DKK 365 each ... This places Enomania somewhere in the middle layer. It's not cheap. But not expensive either.  The staff is knowledgable and friendly. The atmosphere is very friendly and the simple dishes speak for them selves. Lots of taste with no weird stuff to add confusion. Italian food the way mama *thinks* she cooks it :-)  The wines .. wow!","50"
"sandiUKLondon","Great place. went with friends that live in Frederiksberg and love the place. Everything we ate and drank was fantastic, my only issue is a common one in copenhagen and that is the limited options on the menu. Fixed course, so i ate more than I wanted and therefore it was pricier than what i wanted, but again, excellent food. would go again. Loved that it was cozy and seemed ""local"".","40"
"HelloBalou","We had the 4 course dinner with the wine menu. It was excellent. One of the wines I first thought was not as good as the others - but when tasted together with its food I had to surrender: it was an excellent choice. A little warning if you are picky: there is only this one menu, you can coose 3 or 4 courses plus as extra cheese. As a starter on the house we were treated with homebaked foccacia bread with the best olive oil I have tasted plus a choice of Italian charcuterie. They have just received a Bip Goumand and for Danish prices its absolute a bargain. There are only about 25 seats so make a reservation! The chef presented every course and the waiter the wines with a lot of knowledge. And yes you pay 45 DKK for the water (either plain or with gas), but there are refills for free.","50"
"ofy","A cosy small restaurant not too far from Copenhagen Central (Railway) - 10 mins walk - close to the ZOO garden. Open in evenings - and I would think important to make a reservation. The menu is very limited - changed weekly I guess - and your challenge is only to decide the number of courses (4 at maximum plus coffee) and if you want to combine with the wine menu. I will strongly recommend to combine with the wine menu no matter how few courses you choose. The combination of the careful prepared menu and the careful selected wines makes this restaurant worth the visit. At first I didn't think the servings were as large es expected, but in fact the dinner was also in that respect very satisfying. So to be recommended - and by the way an excellent service.","40"
"Sunshine811947","The restaurant Enomania is very praied in professional food reviews, mostly because of the great wine selection. The food is not very special and there are no choices. Beware of the ripoff this posh restaurant do: They ask if you would like some plain tap water. If you accept you will find out that they charge 45 DKK (8$) for a caraf of this alomst for free water.","10"
